{
  "schema_version": "1.0",
  "review_date": "2026-10-20",
  "status": "candidate_supplement",
  "policy": "Research supplement originating on 2026-08-13 and independently source-reviewed during integration on 2026-10-20. Dispositions propose design changes; they do not promote sources into the canonical runtime evidence ledger or establish product efficacy. The canonical ledger remains authoritative until a separately reviewed integration.",
  "sources": [
    {
      "id": "bcto-2023-ontology",
      "type": "peer-reviewed-ontology-development",
      "citation": "Marques, M. M., et al. (2023). The Behaviour Change Technique Ontology: Transforming the Behaviour Change Technique Taxonomy v1.",
      "url": "https://pubmed.ncbi.nlm.nih.gov/37593567/",
      "population": "Ontology experts, behaviour-change researchers, and intervention reports used for annotation reliability.",
      "intervention": "Iterative development and testing of a behaviour change technique ontology.",
      "comparator": "BCT Taxonomy v1 and successive ontology drafts.",
      "duration": "Multi-stage development; not an intervention follow-up study.",
      "outcomes": "The published 2023 ontology described 281 BCTs in 20 groups and annotation reliability; these counts are not an assertion about the current ontology.",
      "result": "Supports standardized active-ingredient names and identifiers; does not rank effectiveness.",
      "design_tier": "ontology-development",
      "risk_of_bias": "Not an efficacy study; terminology coverage and mappings remain iterative.",
      "directness": "high-for-technique-naming-low-for-product-efficacy",
      "runtime_decision": "add",
      "limitation": "An ontology mapping identifies intervention content but does not establish fit or effect for a user.",
      "conflicts_with": [],
      "review_due": "2027-02-13"
    },
    {
      "id": "nist-ai-600-1",
      "type": "official-risk-management-profile",
      "citation": "NIST AI 600-1. Artificial Intelligence Risk Management Framework: Generative Artificial Intelligence Profile (2024).",
      "url": "https://www.nist.gov/publications/artificial-intelligence-risk-management-framework-generative-artificial-intelligence",
      "population": "Organizations designing, developing, deploying, or evaluating generative AI systems.",
      "intervention": "Cross-sector risk-management profile and recommended actions.",
      "comparator": "NIST AI RMF 1.0 without the generative-AI profile.",
      "duration": "Lifecycle guidance.",
      "outcomes": "Governance, measurement, pre-deployment testing, incident disclosure, and risk-management actions.",
      "result": "Supports a control crosswalk and explicit residual-risk/evidence status.",
      "design_tier": "official-guidance",
      "risk_of_bias": "Voluntary framework; not product certification or outcome evidence.",
      "directness": "high-for-governance-low-for-coaching-efficacy",
      "runtime_decision": "add",
      "limitation": "The profile does not specify this product's acceptance thresholds or prove that implemented controls work.",
      "conflicts_with": [],
      "review_due": "2027-02-13"
    },
    {
      "id": "icf-code-ethics-2025",
      "type": "official-professional-code",
      "citation": "International Coaching Federation. ICF Code of Ethics, effective April 1, 2025.",
      "url": "https://coachingfederation.org/credentialing/coaching-ethics/icf-code-of-ethics/",
      "population": "ICF professionals and the ICF ecosystem.",
      "intervention": "Professional ethical commitments and standards.",
      "comparator": "Prior ICF code applicable through March 31, 2025.",
      "duration": "Effective from April 1, 2025.",
      "outcomes": "Current professional expectations for agreements, boundaries, confidentiality, conflicts, and responsibility.",
      "result": "Supports updating the governance crosswalk and date-specific ethics references.",
      "design_tier": "official-professional-code",
      "risk_of_bias": "Professional code, not empirical evidence and not automatically binding on software.",
      "directness": "medium-for-product-governance",
      "runtime_decision": "add",
      "limitation": "The product must not imply ICF credentialing, compliance certification, or a human coaching relationship.",
      "conflicts_with": [],
      "review_due": "2027-04-01"
    },
    {
      "id": "ai-coaching-rct-2025-small",
      "type": "peer-reviewed-randomized-study",
      "citation": "Comparing the effectiveness of LLM-powered coaching with human coaching and GPT conversation (2025).",
      "url": "https://www.tandfonline.com/doi/full/10.1080/17439760.2025.2498132",
      "population": "121 people randomized: 49 LLM-coaching, 36 human-coaching, and 36 GPT-conversation assignments; 32 completed (10, 12, and 10 respectively).",
      "intervention": "A structured LLM-powered coaching protocol.",
      "comparator": "Human coaching and generic GPT-4 conversation.",
      "duration": "One 20-minute session with immediate pre/post measures; no delayed product-outcome trial.",
      "outcomes": "Self-reported coaching-process ratings, pre/post affect, and qualitative feedback. The paper inconsistently reports ten versus eleven process criteria.",
      "result": "Among completers, LLM coaching scored higher than GPT conversation on empathy (p=.02) and encouragement (p=.01); engagement was not significant (p=.10). No detected difference from human coaching does not establish equivalence.",
      "design_tier": "small-randomized-study",
      "risk_of_bias": "High attrition, small completer-only comparisons, subjective ratings, and protocol-specific immediate outcomes limit interpretation and transfer.",
      "directness": "medium-for-conversation-process-low-for-generalized-outcomes",
      "runtime_decision": "defer",
      "limitation": "An immediate small-completer result is neither product-efficacy nor human-equivalence evidence; preserve nonsignificant findings and attrition.",
      "conflicts_with": [
        "human-ai-coaching-rct-2026"
      ],
      "review_due": "2027-02-13"
    },
    {
      "id": "human-ai-coaching-rct-2026",
      "type": "peer-reviewed-randomized-study",
      "citation": "A randomised controlled comparison of the effectiveness of human and AI chatbot coaching with goal attainment, wellbeing and self-efficacy (2026).",
      "url": "https://doi.org/10.1080/13678868.2026.2633990",
      "population": "Reported total N=114 across human coaching, AI coaching, and waitlist control in a leadership sample drawn mainly from one corporate organization; the paper has inconsistent control counts (prose 42 versus Table 3 39).",
      "intervention": "A hybrid scripted and generative WhatsApp coaching system.",
      "comparator": "Accredited human coaching and a waitlist control arm.",
      "duration": "Approximately three months, April-July 2024, with four planned weekly one-hour coaching sessions.",
      "outcomes": "Goal attainment, motivation, self-efficacy, resilience/hardiness, wellbeing, coaching uptake, and dropout.",
      "result": "Human coaching showed broadly stronger improvements than this AI intervention. Not every contrast was significant: the AI self-efficacy difference disappeared after adjustment, and unadjusted hardiness contrasts with the control arm were not significant.",
      "design_tier": "randomized-controlled-study",
      "risk_of_bias": "Not preregistered; unblinded self-reports, differential coaching uptake, and inconsistent control counts limit interpretation. The leadership sample was drawn mainly from one corporate organization, with additional university recruits.",
      "directness": "medium-for-outcome-claim-limits",
      "runtime_decision": "add",
      "limitation": "Require this product's own delayed outcomes. Do not infer universal AI-coaching ineffectiveness, human superiority on every measure, or efficacy for this product.",
      "conflicts_with": [
        "ai-coaching-rct-2025-small"
      ],
      "review_due": "2027-02-13"
    },
    {
      "id": "micro-randomized-trials-2016",
      "type": "peer-reviewed-methodology",
      "citation": "Klasnja, P., et al. (2015). Microrandomized Trials: An Experimental Design for Developing Just-in-Time Adaptive Interventions. Health Psychology. https://doi.org/10.1037/hea0000305",
      "url": "https://dept.stat.lsa.umich.edu/~tewaria/research/klasnja15microrandomized.pdf",
      "population": "Researchers developing just-in-time adaptive interventions.",
      "intervention": "Repeated randomization of intervention options at decision points.",
      "comparator": "Standard parallel trials of integrated intervention packages.",
      "duration": "Longitudinal repeated-decision design.",
      "outcomes": "Proximal effects and moderation by time or context.",
      "result": "Supports estimating proximal component effects and their moderation at repeated decision points, distinct from distal package outcomes. Preregistration is a PGC design requirement, not a reported result of this paper.",
      "design_tier": "methodology",
      "risk_of_bias": "Designed for optimization research; not suitable for rare events and not automatically ethical or useful for personal coaching.",
      "directness": "medium-for-pilot-design",
      "runtime_decision": "defer",
      "limitation": "Do not randomize support, withhold needed help, or covertly experiment on users; any use requires consent and independent review.",
      "conflicts_with": [],
      "review_due": "2027-02-13"
    },
    {
      "id": "scribe-2016",
      "type": "reporting-guideline",
      "citation": "SCRIBE 2016 Statement: Single-Case Reporting Guideline In BEhavioural Interventions.",
      "url": "https://www.equator-network.org/reporting-guidelines/scribe-statement/",
      "population": "Authors and reviewers of single-case experimental designs in behavioural intervention research.",